{
 "format": "qconform-report",
 "format_version": 0,
 "verdict": "pass_with_repairs",
 "descriptor": {"name": "qblox-qcm-qrm", "firmware": "none: dummy cluster", "software": "qblox-1.0.0b8", "descriptor_version": "0"},
 "rejections": [
  {"rule": "envelope_amplitude", "severity": "vendor_repairable", "repair": "saturate_gain", "element": 0, "quantity": "amplitude", "value": {"num": 1, "den": 1}, "limit": {"num": 32767, "den": 32768}}
 ],
 "budgets": [
  {"budget": "pmem_words", "verdict": "fits", "lower_bound": 11, "upper_bound": 20, "limit": 16384}
 ],
 "coverage": [
  {"class": "pulse_length_range", "status": "checked"},
  {"class": "pulse_length_grid", "status": "checked"},
  {"class": "readout_length_range", "status": "not_applicable"},
  {"class": "frequency_range", "status": "checked"},
  {"class": "frequency_resolution", "status": "checked"},
  {"class": "phase_resolution", "status": "checked"},
  {"class": "amplitude_range", "status": "not_applicable"},
  {"class": "amplitude_resolution", "status": "not_applicable"},
  {"class": "envelope_sample_grid", "status": "checked"},
  {"class": "envelope_amplitude", "status": "checked"},
  {"class": "envelope_memory", "status": "checked"},
  {"class": "schedule_grid", "status": "checked"},
  {"class": "negative_duration", "status": "checked"},
  {"class": "negative_time", "status": "not_applicable"},
  {"class": "mux_tone_mask", "status": "not_applicable"},
  {"class": "mux_tone_count", "status": "not_applicable"},
  {"class": "start_spacing", "status": "checked"},
  {"class": "frequency_update_spacing", "status": "not_applicable"},
  {"class": "capture_spacing", "status": "not_applicable"},
  {"class": "pmem_words", "status": "checked"},
  {"class": "wmem_words", "status": "not_applicable"},
  {"class": "loop_registers", "status": "not_applicable"},
  {"class": "unconstrained_channel", "status": "not_applicable"}
 ]
}
